21, What Alice Forgot, Liane Moriarty, 9780141043760, English, 487, May 1 2009, Fiction* Chick Lit* Contemporary* Romance* Audiobook* Mystery* Adult, 4.08 avg rating - 442.349 ratings, 1.516, 16, https://www.goodreads.com/book/show/6469165-what-alice-forgot, https://images-na.ssl-images-amazon.com/images/S/compressed.photo.goodreads.com/books/1377159022i/6469165.jpg, https://i.gr-assets.com/images/S/compressed.photo.goodreads.com/books/1377159022i/6469165._SY75_.jpg, Alice Love is twenty-nine* crazy about her husband* and pregnant with her first child. So imagine Alice’s surprise when she comes to on the floor of a gym and is whisked off to the hospital where she discovers the honeymoon is truly over — she’s getting divorced* she has three kids and she’s actually 39 years old. Alice must reconstruct the events of a lost decade* and find out whether it’s possible to reconstruct her life at the same time. She has to figure out why her sister hardly talks to her* and how is it that she’s become one of those super skinny moms with really expensive clothes. Ultimately* Alice must discover whether forgetting is a blessing or a curse* and whether it’s possible to start over. , https://www.goodreads.com/author/show/322069.Liane_Moriarty, https://images.gr-assets.com/authors/1459827224p5/322069.jpg, Sydney* Australia, http://www.lianemoriarty.com, Liane Moriarty is the author of the #1 New York Times bestsellers Big Little Lies* The Husband’s Secret* and Truly Madly Guilty- the New York Times bestsellers Apples Never Fall* Nine Perfect Strangers* What Alice Forgot* and The Last Anniversary- The Hypnotist’s Love Story- and Three Wishes. She lives in Sydney* Australia* with her husband and two children.
22, Before I Go, Colleen Oakley, 9781476761664, English, 309, January 6 2015, Fiction* Romance* Contemporary* Chick Lit* Adult* Adult Fiction* Audiobook, 3.80 avg rating - 12.854 ratings, 1.169, 12, https://www.goodreads.com/book/show/20871704-before-i-go, https://images-na.ssl-images-amazon.com/images/S/compressed.photo.goodreads.com/books/1397917357i/20871704.jpg, https://i.gr-assets.com/images/S/compressed.photo.goodreads.com/books/1397917357i/20871704._SY75_.jpg, A heart-wrenching debut novel in the bestselling tradition of P. S. I Love You about a young woman with breast cancer who undertakes a mission to find a new wife for her husband before she passes away. Twenty-seven-year-old Daisy already beat breast cancer three years ago. How can this be happening to her again?On the eve of what was supposed to be a triumphant “Cancerversary” with her husband Jack to celebrate three years of being cancer-free* Daisy suffers a devastating blow: her doctor tells her that the cancer is back* but this time it’s an aggressive stage four diagnosis. She may have as few as four months left to live. Death is a frightening prospect—but not because she’s afraid for herself. She’s terrified of what will happen to her brilliant but otherwise charmingly helpless husband when she’s no longer there to take care of him. It’s this fear that keeps her up at night* until she stumbles on the solution: she has to find him another wife. With a singular determination* Daisy scouts local parks and coffee shops and online dating sites looking for Jack’s perfect match. But the further she gets on her quest* the more she questions the sanity of her plan. As the thought of her husband with another woman becomes all too real* Daisy’s forced to decide what’s more important in the short amount of time she has left: her husband’s happiness—or her own?, https://www.goodreads.com/author/show/3126893.Colleen_Oakley, https://images.gr-assets.com/authors/1396903027p5/3126893.jpg, , http://www.colleenoakley.com, Colleen Oakley is the USA Today bestselling author of The Invisible Husband of Frick Island* You Were There Too and other unconventional love stories. Her books have been named best books by People Magazine* Us Weekly* Library Journal* and Real Simple* and long-listed for the Pat Conroy Southern Book Prize. Her fifth novel THE MOSTLY TRUE STORY OF TANNER & LOUISE will be published by Berkley/Penguin in March 2023.
23, As Chimney Sweepers Come to Dust (Flavia de Luce #7), Alan Bradley, 9780345539939, English, 392, January 6 2015, Mystery* Fiction* Historical Fiction* Audiobook* Young Adult* Historical* Canada, 3.96 avg rating - 26.685 ratings, 1.092, 11, https://www.goodreads.com/book/show/21874813-as-chimney-sweepers-come-to-dust, https://images-na.ssl-images-amazon.com/images/S/compressed.photo.goodreads.com/books/1406214651i/21874813.jpg, https://i.gr-assets.com/images/S/compressed.photo.goodreads.com/books/1406214651i/21874813._SX50_.jpg, NEW YORK TIMES BESTSELLERFlavia de Luce—“part Harriet the Spy* part Violet Baudelaire from Lemony Snicket’s A Series of Unfortunate Events” (The New York Times Book Review)—takes her remarkable sleuthing prowess to the unexpectedly unsavory world of Canadian boarding schools in the captivating new mystery from New York Times bestselling author Alan Bradley. Banished! is how twelve-year-old Flavia de Luce laments her predicament* when her father and Aunt Felicity ship her off to Miss Bodycote’s Female Academy* the boarding school that her mother* Harriet* once attended across the sea in Canada. The sun has not yet risen on Flavia’s first day in captivity when a gift lands at her feet. Flavia being Flavia* a budding chemist and sleuth* that gift is a charred and mummified body* which tumbles out of a bedroom chimney. Now* while attending classes* making friends (and enemies)* and assessing the school’s stern headmistress and faculty (one of whom is an acquitted murderess)* Flavia is on the hunt for the victim’s identity and time of death* as well as suspects* motives* and means. Rumors swirl that Miss Bodycote’s is haunted* and that several girls have disappeared without a trace. When it comes to solving multiple mysteries* Flavia is up to the task—but her true destiny has yet to be revealed. Praise for As Chimney Sweepers Come to Dust  “Flavia de Luce [is] perhaps contemporary crime fiction’s most original character—to say she is Pippi Longstocking with a Ph. D. in chemistry (speciality: poisons) barely begins to describe her. ”—Maclean’s  “Another treat for readers of all ages . . . [As Chimney Sweepers Come to Dust] maintains the high standards Bradley set from the start. ”—Booklist  “Exceptional . . . [The] intriguing setup only gets better* and Bradley makes Miss Bodycote’s a suitably Gothic setting for Flavia’s sleuthing. Through it all* her morbid narrative voice continues to charm. ”—Publishers Weekly (starred review)  “Even after all these years* Flavia de Luce is still the world’s greatest adolescent British chemist/busybody/sleuth. ”—The Seattle Times  “Plot twists come faster than Canadian snowfall. . . . Bradley’s sense of observation is as keen as gung-ho scientist Flavia’s. . . . The results so far are seven sparkling Flavia de Luce mysteries. ”—Library Journal   “A rattling good ‘girls’ own adventure’ yarn with an extensive cast of characters and suspects . . . When all is revealed* the links* misunderstandings and secrecy have a satisfying click. ”—Winnipeg Free Press  “A delightful installment in the series!”—LibraryReads  Acclaim for Alan Bradley’s beloved Flavia de Luce novels* winners of the Crime Writers’ Association Debut Dagger Award* Barry Award* Agatha Award* Macavity Award* Dilys Winn Award* and Arthur Ellis Award   “If ever there were a sleuth who’s bold* brilliant* and* yes* adorable* it’s Flavia de Luce. ”—USA Today   “This idiosyncratic young heroine continues to charm. ”—The Wall Street Journal   “Delightful . . . a combination of Eloise and Sherlock Holmes. ”—The Boston GlobeFrom the Hardcover edition. , https://www.goodreads.com/author/show/1074866.Alan_Bradley, https://images.gr-assets.com/authors/1256021843p5/1074866.jpg, Toronto* Canada, http://www.alanbradleyauthor.com, Librarian Note: There is more than one author in the Goodreads database with this name. With an education in electronic engineering* Alan worked at numerous radio and television stations in Ontario* and at Ryerson Polytechnical Institute (now Ryerson University) in Toronto* before becoming Director of Television Engineering in the media centre at the University of Saskatchewan in Saskatoon* where he remained for 25 years before taking early retirement to write in 1994.He became the first President of the Saskatoon Writers* and a founding member of the Saskatchewan Writers Guild. His children's stories were published in The Canadian Children's Annual* and his short story* Meet Miss Mullen* was the first recipient of the Saskatchewan Writers 
24, Revival, Stephen King, 9781476770383, English, 405, January 1 2014, Horror* Fiction* Thriller* Fantasy* Mystery* Audiobook* Science Fiction, 3.80 avg rating - 118.401 ratings, 1.080, 11, https://www.goodreads.com/book/show/20926278-revival, https://images-na.ssl-images-amazon.com/images/S/compressed.photo.goodreads.com/books/1510335323i/20926278.jpg, https://i.gr-assets.com/images/S/compressed.photo.goodreads.com/books/1510335323i/20926278._SY75_.jpg, A dark and electrifying novel about addiction* fanaticism* and what might exist on the other side of life. In a small New England town* over half a century ago* a shadow falls over a small boy playing with his toy soldiers. Jamie Morton looks up to see a striking man* the new minister. Charles Jacobs* along with his beautiful wife* will transform the local church. The men and boys are all a bit in love with Mrs. Jacobs the women and girls feel the same about Reverend Jacobs—including Jamie's mother and beloved sister* Claire. With Jamie* the Reverend shares a deeper bond based on a secret obsession. When tragedy strikes the Jacobs family* this charismatic preacher curses God* mocks all religious belief* and is banished from the shocked town. Jamie has demons of his own. Wed to his guitar from the age of thirteen* he plays in bands across the country* living the nomadic lifestyle of bar-band rock and roll while fleeing from his family's horrific loss. In his mid-thirties—addicted to heroin* stranded* desperate—Jamie meets Charles Jacobs again* with profound consequences for both men. Their bond becomes a pact beyond even the Devil's devising* and Jamie discovers that revival has many meanings. This rich and disturbing novel spans five decades on its way to the most terrifying conclusion Stephen King has ever written. It's a masterpiece from King* in the great American tradition of Frank Norris* Nathaniel Hawthorne* and Edgar Allan Poe. , https://www.goodreads.com/author/show/3389.Stephen_King, https://images.gr-assets.com/authors/1362814142p5/3389.jpg, Portland* Maine* The United States, http://www.stephenking.com, Stephen Edwin King was born the second son of Donald and Nellie Ruth Pillsbury King. After his father left them when Stephen was two* he and his older brother* David* were raised by his mother. Parts of his childhood were spent in Fort Wayne* Indiana* where his father's family was at the time* and in Stratford* Connecticut. When Stephen was eleven* his mother brought her children back to Durham* Maine* for good. Her parents* Guy and Nellie Pillsbury* had become incapacitated with old age* and Ruth King was persuaded by her sisters to take over the physical care of them. Other family members provided a small house in Durham and financial support. After Stephen's grandparents passed away* Mrs. King found work in the kitchens of Pineland* a ne
25, Edge of Eternity (The Century Trilogy #3), Ken Follett, 9780525953098, English, 1098, September 16 2014, Historical Fiction* Fiction* Historical* Audiobook* War* Novels* Adult, 4.17 avg rating - 99.436 ratings, 1.065, 11, https://www.goodreads.com/book/show/11389875-edge-of-eternity, https://images-na.ssl-images-amazon.com/images/S/compressed.photo.goodreads.com/books/1377871984i/11389875.jpg, https://i.gr-assets.com/images/S/compressed.photo.goodreads.com/books/1377871984i/11389875._SY75_.jpg, Edge of Eternity is the sweeping* passionate conclusion to Ken Follett’s extraordinary historical epic* The Century Trilogy. Throughout these books* Follett has followed the fortunes of five intertwined families – American* German* Russian* English* and Welsh – as they make their way through the twentieth century. Now they come to one of the most tumultuous eras of all: the enormous social* political* and economic turmoil of the 1960s through the 1980s* from civil rights* assassinations* mass political movements and Vietnam to the Berlin Wall* the Cuban Missile Crisis* presidential impeachment* revolution – and rock and roll. East German teacher Rebecca Hoffman discovers she’s been spied on by the Stasi for years and commits an impulsive act that will affect her family for the rest of their lives. …George Jakes* the child of a mixed-race couple* bypasses a corporate law career to join Robert F. Kennedy’s Justice Department* and finds himself in the middle not only of the seminal events of the civil rights battle* but a much more personal battle of his own. …Cameron Dewar* the grandson of a senator* jumps at the chance to do some official and unofficial espionage for a cause he believes in* only to discover that the world is a much more dangerous place than he’d imagined. …Dimka Dvorkin* a young aide to Nikita Khrushchev* becomes a prime agent both for good and for ill as the United States and the Soviet Union race to the brink of nuclear war* while his twin sister* Tania* carves out a role that will take her from Moscow to Cuba to Prague to Warsaw – and into history. As always with Follett* the historical background is brilliantly researched and rendered* the action fast-moving* the characters rich in nuance and emotion. With the hand of a master* he brings us into a world we thought we knew but now will never seem the same again. , https://www.goodreads.com/author/show/3447.Ken_Follett, https://images.gr-assets.com/authors/1604049089p5/3447.jpg, Cardiff* The United Kingdom, http://www.ken-follett.com/, Ken Follett is one of the world’s most successful authors. Over 170 million copies of the 36 books he has written have been sold in over 80 countries and in 33 languages.Born on June 5th* 1949 in Cardiff* Wales* the son of a tax inspector* Ken was educated at state schools and went on to graduate from University College* London* with an Honours degree in Philosophy – later to be made a Fellow of the College in 1995.He started his career as a reporter* first with his hometown newspaper the South Wales Echo and then with the London Evening News. Subsequently* he worked for a small London publishing house* Everest Books* eventually becoming Deputy Managing Director.Ken’s first major success came with the publication of Eye of the Needle in 197
26, The Selection (The Selection #1), Kiera Cass, 9780062059932, English, 336, April 24 2012, Young Adult* Romance* Dystopia* Fantasy* Fiction* Science Fiction* Audiobook, 4.09 avg rating - 1.412.131 ratings, 1.064, 11, https://www.goodreads.com/book/show/10507293-the-selection, https://images-na.ssl-images-amazon.com/images/S/compressed.photo.goodreads.com/books/1322103400i/10507293.jpg, https://i.gr-assets.com/images/S/compressed.photo.goodreads.com/books/1322103400i/10507293._SY75_.jpg, For thirty-five girls* the Selection is the chance of a lifetime. The opportunity to escape the life laid out for them since birth. To be swept up in a world of glittering gowns and priceless jewels. To live in a palace and compete for the heart of gorgeous Prince Maxon. But for America Singer* being Selected is a nightmare. It means turning her back on her secret love with Aspen* who is a caste below her. Leaving her home to enter a fierce competition for a crown she doesn't want. Living in a palace that is constantly threatened by violent rebel attacks. Then America meets Prince Maxon. Gradually* she starts to question all the plans she's made for herself—and realizes that the life she's always dreamed of may not compare to a future she never imagined. , https://www.goodreads.com/author/show/2987125.Kiera_Cass, https://images.gr-assets.com/authors/1318605410p5/2987125.jpg, The United States, http://www.kieracass.com/, 100 Things I Love:Being married. Cake. The smell of Autumn. Motherhood. Books. Elephants. Back rubs. On demand movies. Actually going out to movies. Faith. Cinnamon rolls. My family. Butterflies. When my kitchen is clean. Crayons. Pink. Tote bags. Dancing. Organizing via color coordination. That my wedding dress was tea length* not floor. Baking. My house. Writing utensils. Paper. India. The sound of water. Making videos. Buttons. The word Episcopalian. Making people laugh. Layering clothes. British accents. Pinterest. Animation. Fireworks. The smell of the Ocean. My wedding rings. Aprons. Reasons to get dressed up. Sex. Pop music. Stars. Taking walks. Daydreaming. Stickers. School Spirit. My friends. Living in a small town. Japan. Singing.
27, Station Eleven, Emily St. John Mandel, 9780385353304, English, 333, September 9 2014, Fiction* Science Fiction* Dystopia* Post Apocalyptic* Audiobook* Adult* Fantasy, 4.07 avg rating - 467.260 ratings, 1.062, 11, https://www.goodreads.com/book/show/20170404-station-eleven, https://images-na.ssl-images-amazon.com/images/S/compressed.photo.goodreads.com/books/1680459872i/20170404.jpg, https://i.gr-assets.com/images/S/compressed.photo.goodreads.com/books/1680459872i/20170404._SX50_.jpg, Set in the days of civilization's collapse* Station Eleven tells the story of a Hollywood star* his would-be savior* and a nomadic group of actors roaming the scattered outposts of the Great Lakes region* risking everything for art and humanity. One snowy night a famous Hollywood actor slumps over and dies onstage during a production of King Lear. Hours later* the world as we know it begins to dissolve. Moving back and forth in time—from the actor's early days as a film star to fifteen years in the future* when a theater troupe known as the Traveling Symphony roams the wasteland of what remains—this suspenseful* elegiac* spellbinding novel charts the strange twists of fate that connect five people: the actor* the man who tried to save him* the actor's first wife* his oldest friend* and a young actress with the Traveling Symphony* caught in the crosshairs of a dangerous self-proclaimed prophet. , https://www.goodreads.com/author/show/2786093.Emily_St_John_Mandel, https://images.gr-assets.com/authors/1576606299p5/2786093.jpg, Comox* British Columbia* Canada, http://www.emilymandel.com, Emily St. John Mandel was born and raised on the west coast of British Columbia* Canada. She studied contemporary dance at the School of Toronto Dance Theatre and lived briefly in Montreal before relocating to New York. She is the author of five novels* including The Glass Hotel (spring 2020) and Station Eleven (2014.) Station Eleven was a finalist for a National Book Award and the PEN/Faulkner Award* won the Morning News Tournament of Books* and has been translated into 34 languages. She lives in NYC with her husband and daughter. 
28, Paper Towns, John Green, 9780142414934, English, 305, October 16 2008, Young Adult* Fiction* Contemporary* Romance* Mystery* Realistic Fiction* Coming Of Age, 3.72 avg rating - 1.262.732 ratings, 1.062, 11, https://www.goodreads.com/book/show/6442769-paper-towns, https://images-na.ssl-images-amazon.com/images/S/compressed.photo.goodreads.com/books/1349013610i/6442769.jpg, https://i.gr-assets.com/images/S/compressed.photo.goodreads.com/books/1349013610i/6442769._SX50_.jpg, Who is the real Margo?Quentin Jacobsen has spent a lifetime loving the magnificently adventurous Margo Roth Spiegelman from afar. So when she cracks open a window and climbs into his life—dressed like a ninja and summoning him for an ingenious campaign of revenge—he follows. After their all-nighter ends* and a new day breaks* Q arrives at school to discover that Margo* always an enigma* has now become a mystery. But Q soon learns that there are clues—and they're for him. Urged down a disconnected path* the closer he gets* the less Q sees the girl he thought he knew. . . , https://www.goodreads.com/author/show/1406384.John_Green, https://images.gr-assets.com/authors/1353452301p5/1406384.jpg, Indianapolis* The United States, http://www.johngreenbooks.com/, Librarian Note: There is more than one author in the Goodreads database with this name.John Green's first novel* Looking for Alaska* won the 2006 Michael L. Printz Award presented by the American Library Association. His second novel* An Abundance of Katherines* was a 2007 Michael L. Printz Award Honor Book and a finalist for the Los Angeles Times Book Prize. His next novel* Paper Towns* is a New York Times bestseller and won the Edgar Allen Poe Award for Best YA Mystery. In January 2012* his most recent novel* The Fault in Our Stars* was met with wide critical acclaim* unprecedented in Green's career. The praise included rave reviews in Time Magazine and The New York Times* on NPR* and from award-winning author Markus Zusak. The book also 
29, The Perks of Being a Wallflower, Stephen Chbosky, null, English, 213, February 1 1999, Young Adult* Fiction* Contemporary* Classics* Mental Health* Realistic Fiction* LGBT, 4.22 avg rating - 1.663.422 ratings, 1.061, 11, https://www.goodreads.com/book/show/22628.The_Perks_of_Being_a_Wallflower, https://images-na.ssl-images-amazon.com/images/S/compressed.photo.goodreads.com/books/1650033115i/22628.jpg, https://i.gr-assets.com/images/S/compressed.photo.goodreads.com/books/1650033115i/22628._SX50_.jpg, standing on the fringes of life. . . offers a unique perspective. But there comes a time to seewhat it looks like from the dance floor. This haunting novel about the dilemma of passivity vs. passion marks the stunning debut of a provocative new voice in contemporary fiction: The Perks of Being A WALLFLOWERThis is the story of what it's like to grow up in high school. More intimate than a diary* Charlie's letters are singular and unique* hilarious and devastating. We may not know where he lives. We may not know to whom he is writing. All we know is the world he shares. Caught between trying to live his life and trying to run from it puts him on a strange course through uncharted territory. The world of first dates and mixed tapes* family dramas and new friends. The world of sex* drugs* and The Rocky Horror Picture Show* when all one requires is that the perfect song on that perfect drive to feel infinite. Through Charlie* Stephen Chbosky has created a deeply affecting coming-of-age story* a powerful novel that will spirit you back to those wild and poignant roller coaster days known as growing up. (back cover), https://www.goodreads.com/author/show/12898.Stephen_Chbosky, https://images.gr-assets.com/authors/1599132962p5/12898.jpg, Pittsburgh* The United States, Stephen Chbosky’s books, Stephen Chbosky grew up in Pittsburgh* Pennsylvania* and graduated from the University of Southern California's Filmic Writing Program. His first film* The Four Corners of Nowhere* premiered at the 1995 Sundance Film Festival and went on to win Best Narrative Feature honors at the Chicago Underground Film Festival. He is the recipient of the Abraham Polonsky Screenwriting Award for his screenplay Everything Divided as well as a participant in the Sundance Institute's filmmakers' lab for his current project* Fingernails and Smooth Skin. Chbosky lives in New York. For more information* please see http://en.wikipedia.org/wiki/Stephen_...
