71, The Girl in the Spider's Web (Millennium #4), David Lagercrantz, null, English, 416, January 1 2015, Fiction* Mystery* Thriller* Crime* Mystery Thriller* Audiobook* Suspense, 3.79 avg rating - 154.124 ratings, 200, 2, https://www.goodreads.com/book/show/25196214-the-girl-in-the-spider-s-web, https://images-na.ssl-images-amazon.com/images/S/compressed.photo.goodreads.com/books/1427843609i/25196214.jpg, https://i.gr-assets.com/images/S/compressed.photo.goodreads.com/books/1427843609i/25196214._SX50_.jpg, #1 NATIONAL BESTSELLER • Lisbeth Salander and Mikael Blomkvist return to the Girl in the Dragon Tattoo series in this ripped-from-the-headlines* high-octane follow-up to Stieg Larsson's The Girl Who Kicked the Hornet's Nest .  • Also known as the Millennium series“Rest easy* Lisbeth Salander fans—our punk hacker heroine is in good hands. … A twisty* bloody thrill ride. … An instant page-turner. ” — USA TodayThe next installment in the Millennium a genius hacker who has always been an outsider a journalist with a penchant for danger. She is Lisbeth Salander* the girl with the dragon tattoo. He is Mikael Blomkvist* crusading editor of Millennium. One night* Blomkvist receives a call from a source who claims to have been given information vital to the United States by a young female hacker. Blomkvist* always on the lookout for a story* reaches out to Salander for help. She* as usual* has plans of her own. Together they are drawn into a ruthless underworld of spies* cybercriminals* and government operatives—some willing to kill to protect their secrets. Look for the latest book in the Girl with the Dragon Tattoo series* The Girl in the Eagle's Talons * coming soon!, https://www.goodreads.com/author/show/242659.David_Lagercrantz, https://images.gr-assets.com/authors/1558362373p5/242659.jpg, Sweden, http://www.davidlagercrantz.se/Home.htm, David Lagercrantz* born in 1962* is a journalist and author* living in Stockholm. His first book was published in 1997* a biography of the Swedish adventurer and mountaineer Göran Kropp. In 2000 his biography on the inventor Håkan Lans* A Swedish Genious* was published. His breakthrough as a novelist was Fall of Man in Wilmslow* a fictionalised novel about the British mathematician Alan Turing. In David Lagercrantz' writing you can often see a pattern: major talents who refuse to follow convention. He has been interested not only in what it takes to stand out from the crowd* but also in the resistance that such creativity inevitably faces.In 2011 his best-selling sports biography I am Zlatan Ibrahimović was published* one of the most succes
72, The Fifth Gospel, Ian Caldwell, 9781451694147, English, 431, January 1 2014, Fiction* Mystery* Historical Fiction* Thriller* Mystery Thriller* Religion* Audiobook, 3.73 avg rating - 10.531 ratings, 198, 2, https://www.goodreads.com/book/show/22609406-the-fifth-gospel, https://images-na.ssl-images-amazon.com/images/S/compressed.photo.goodreads.com/books/1423486137i/22609406.jpg, https://i.gr-assets.com/images/S/compressed.photo.goodreads.com/books/1423486137i/22609406._SY75_.jpg, A mysterious exhibit is under construction at the Vatican Museums. The curator is murdered at a clandestine meeting on the outskirts of Rome a week before it opens. That same night* a violent break-in rocks the home of Greek Catholic priest Father Alex Andreou. When the papal police fail to identify a suspect in either crime* Father Alex decides that to find the killer he must reconstruct the secret of what a little-known* true-to-life fifth gospel known as the Diatessaron reveals about the church’s most controversial holy relic. But just as he begins to understand the truth about his friend’s death and its consequences for the future of the Christian church* Father Alex discovers a ruthless stalker is hunting him—an enemy with a vested stake in the exhibit that he must outwit to survive. Rich* authentic* erudite* and emotionally searing* The Fifth Gospel is a riveting novel of suspense and a feast of biblical history that satisfies on every level. , https://www.goodreads.com/author/show/11111.Ian_Caldwell, https://images.gr-assets.com/authors/1422460776p5/11111.jpg, The United States, Ian Caldwell’s books, Ian Caldwell is an American novelist. After graduating from Princeton University in 1998* he and his childhood friend Dustin Thomason co-wrote the semi-autobiographical The Rule of Four* which was published in 2004.Caldwell and Thomason graduated from the Thomas Jefferson High School for Science and Technology* in Fairfax County* Virginia* in 1994. Caldwell was a Phi Beta Kappa in history at Princeton. In 2005* Caldwell's wife* Meredith* gave birth to their first child* Ethan Sawyer Caldwell. They live in Vienna* Virginia.
73, A Thousand Pieces of You (Firebird #1), Claudia Gray, 9780062278968, English, 368, November 4 2014, Young Adult* Science Fiction* Fantasy* Romance* Time Travel* Fiction* Dystopia, 3.90 avg rating - 56.467 ratings, 198, 2, https://www.goodreads.com/book/show/17234658-a-thousand-pieces-of-you, https://images-na.ssl-images-amazon.com/images/S/compressed.photo.goodreads.com/books/1400166295i/17234658.jpg, https://i.gr-assets.com/images/S/compressed.photo.goodreads.com/books/1400166295i/17234658._SY75_.jpg, Marguerite Caine's physicist parents are known for their groundbreaking achievements. Their most astonishing invention* called the Firebird* allows users to jump into multiple universes—and promises to revolutionize science forever. But then Marguerite's father is murdered* and the killer—her parent's handsome* enigmatic assistant Paul— escapes into another dimension before the law can touch him. Marguerite refuses to let the man who destroyed her family go free. So she races after Paul through different universes* always leaping into another version of herself. But she also meets alternate versions of the people she knows—including Paul* whose life entangles with hers in increasingly familiar ways. Before long she begins to question Paul's guilt—as well as her own heart. And soon she discovers the truth behind her father's death is far more sinister than she expected. , https://www.goodreads.com/author/show/1192311.Claudia_Gray, https://images.gr-assets.com/authors/1234643683p5/1192311.jpg, The United States, http://www.claudiagray.com/, Claudia Gray is not my real name. I didn't choose a pseudonym because my real name is unpleasant (it isn't)* because I'd always dreamed of calling myself this (I haven't) or even because I'm hiding from the remnants of that international diamond-smuggling cartel I smashed in 2003 (Interpol has taken care of them). In short* I took a pseudonym for no real reason whatsoever. Sometimes this is actually the best reason to do things.I live in New Orleans. So far* in life* I've been a disc jockey* a lawyer* a journalist and an extremely bad waitress* just to name a few. I especially like to spend time traveling* hiking* reading and listening to music. More than anything else* I enjoy writing. 
74, Shadows (The Rephaim #1), Paula Weston, 9781921922503, English, 388, June 1 2012, Angels* Fantasy* Young Adult* Paranormal* Romance* Urban Fantasy* New Adult, 3.96 avg rating - 7.994 ratings, 197, 2, https://www.goodreads.com/book/show/13414835-shadows, https://images-na.ssl-images-amazon.com/images/S/compressed.photo.goodreads.com/books/1337426703i/13414835.jpg, https://i.gr-assets.com/images/S/compressed.photo.goodreads.com/books/1337426703i/13414835._SY75_.jpg, It’s almost a year since Gaby Winters was in the car crash that killed her twin brother* Jude. Her body has healed in the sunshine of Pandanus Beach* but her grief is raw and constant. It doesn’t help that every night in her dreams she kills demons and other hell-spawn. And then Rafa comes to town. Not only does he look exactly like the guy who’s been appearing in Gaby’s dreams—he claims a history with her brother that makes no sense. Gaby is forced to accept that what she thought she knew about herself and her life is only a shadow of the truth—and that the truth is more likely to be found in the shadows of her nightmares. Who is Rafa? Who are the Rephaim? And most importantly* who can she trust?Fast-paced and gripping* Shadows* the first book in the Rephaim series. , https://www.goodreads.com/author/show/5446913.Paula_Weston, https://images.gr-assets.com/authors/1393844186p5/5446913.jpg, Australia, http://www.paula-weston.com, Paula Weston is the author of the Rephaim series (Shadows* Haze* Shimmer and Burn). The Undercurrent* a stand-alone speculative thriller set in near-future Australia* is now available in Australia and New Zealand.Paula worked as a print journalist for many years before becoming a government media and communication specialist. Today she also co-owns a two-woman communication and design agency.She grew up in regional South Australia and now lives in Brisbane* Queensland* with her husband.
75, The Assassin (Isaac Bell #8), Clive Cussler, 9780399171758, English, 409, March 3 2015, Fiction* Adventure* Mystery* Historical Fiction* Thriller* Action* Audiobook, 4.05 avg rating - 5.414 ratings, 196, 2, https://www.goodreads.com/book/show/22571740-the-assassin, https://images-na.ssl-images-amazon.com/images/S/compressed.photo.goodreads.com/books/1405293598i/22571740.jpg, https://i.gr-assets.com/images/S/compressed.photo.goodreads.com/books/1405293598i/22571740._SY75_.jpg, Detective Isaac Bell tracks a killer across the nation’s oilfields in this adventure in the #1 New York Times–bestselling historical series.  As Van Dorn private detective Isaac Bell strives to land a government contract to investigate John D. Rockefeller’s Standard Oil monopoly* the case takes a deadly turn. A sniper begins murdering opponents of Standard Oil* and soon the assassin—shooting with extraordinary accuracy at seemingly impossible long range—kills Bell’s best witness. Then the shooter detonates a terrible explosion that sets the victim’s independent refinery ablaze. Bell summons his best detectives to hunt down the mysterious killer. But the murders—shootings* poisonings* staged accidents—have just begun as Bell tracks his phantom-like criminal adversary from the “oil fever” regions of Kansas and Texas to Washington* D. C. * to the tycoons’ enclave of New York* to Russia’s war-torn Baku oil fields on the Caspian Sea* and back to America for a final* desperate confrontation. And this one will be the most explosive of all. , https://www.goodreads.com/author/show/18411.Clive_Cussler, https://images.gr-assets.com/authors/1225620641p5/18411.jpg, Alhambra* The United States, http://www.cusslerbooks.com/, Cussler began writing novels in 1965 and published his first work featuring his continuous series hero* Dirk Pitt* in 1973. His first non-fiction* The Sea Hunters* was released in 1996. The Board of Governors of the Maritime College* State University of New York* considered The Sea Hunters in lieu of a Ph.D. thesis and awarded Cussler a Doctor of Letters degree in May* 1997. It was the first time since the College was founded in 1874 that such a degree was bestowed. Cussler was an internationally recognized authority on shipwrecks and the founder of the National Underwater and Marine Agency* (NUMA) a 501C3 non-profit organization (named after the fictional Federal agency in his novels) that dedicates itself to preserving American maritime a
76, Die Again (Rizzoli & Isles #11), Tess Gerritsen, 9780345543851, English, 330, December 30 2014, Mystery* Thriller* Crime* Fiction* Mystery Thriller* Suspense* Detective, 4.19 avg rating - 28.428 ratings, 196, 2, https://www.goodreads.com/book/show/21489683-die-again, https://images-na.ssl-images-amazon.com/images/S/compressed.photo.goodreads.com/books/1395144977i/21489683.jpg, https://i.gr-assets.com/images/S/compressed.photo.goodreads.com/books/1395144977i/21489683._SY75_.jpg, The latest enthralling case in Tess Gerritsen's New York Times bestselling Rizzoli & Isles series* the blockbuster books behind the smash hit TNT series. Boston Detective Jane Rizzoli is on the case of a big game hunter found dead in his apartment* alone with the body of a beautiful white snow leopard he had recently been commissioned to procure and stuff for a high-profile museum in the area. Medical examiner Maura Isles connects the case to a number of seemingly unrelated deaths where the victims have all been found hanging upside down* the hallmark of a leopard's kill. Rizzoli follows the puzzling trail of clues all the way to Botswana* where she uncovers the unsolved mystery of a deadly camping safari six years prior. When she realizes the two cases are connected* Rizzoli must track down the sole survivor of the tragic trip to discover who - or what - is behind these gruesome deaths. Story Locale: Boston* MA, https://www.goodreads.com/author/show/18149.Tess_Gerritsen, https://images.gr-assets.com/authors/1416348007p5/18149.jpg, The United States, http://www.tessgerritsen.com/, Internationally bestselling author Tess Gerritsen took an unusual route to a writing career. A graduate of Stanford University* Tess went on to medical school at the University of California* San Francisco* where she was awarded her M.D.While on maternity leave from her work as a physician* she began to write fiction. In 1987* her first novel was published. Call After Midnight* a romantic thriller* was followed by eight more romantic suspense novels. She also wrote a screenplay* "Adrift"* which aired as a 1993 CBS Movie of the Week starring Kate Jackson.Tess's first medical thriller* Harvest* was released in hardcover in 1996* and it marked her debut on the New York Times bestseller list. Her suspense novels since then have been: Life Suppo
77, Insatiable Appetites (Stone Barrington #32), Stuart Woods, 9780399169151, English, 320, January 6 2015, Mystery* Fiction* Thriller* Audiobook* Suspense* Crime* Mystery Thriller, 3.87 avg rating - 5.539 ratings, 196, 2, https://www.goodreads.com/book/show/22521941-insatiable-appetites, https://images-na.ssl-images-amazon.com/images/S/compressed.photo.goodreads.com/books/1406505908i/22521941.jpg, https://i.gr-assets.com/images/S/compressed.photo.goodreads.com/books/1406505908i/22521941._SY75_.jpg, Stone Barrington returns in the new action-packed thriller from the #1 New York Times –bestselling author.  It’s a time of unexpected change for Stone Barrington. A recent venture has achieved a great victory* but is immediately faced with a new challenge: an underhanded foe who’s determined to wreak havoc at any cost. Meanwhile* when Stone finds himself responsible for distributing the estate of a respected friend and mentor* the process unearths secrets that range from merely surprising to outright alarming. And when a lethal beauty from Stone’s past resurfaces* there’s no telling what chaos will follow in her wake . . . Ever a master of keeping cool under pressure* even Stone might have his work cut out for him this time . . . because when grand ambitions collide with criminal inclinations* the results may be more deadly than he could have anticipated. , https://www.goodreads.com/author/show/3936.Stuart_Woods, https://images.gr-assets.com/authors/1202427385p5/3936.jpg, Manchester* Georgia* The United States, http://www.stuartwoods.com/, Stuart Woods was the author the New York Times-bestselling Stone Barrington series and Holly Barker series. He was an avid private pilot* flying his own jet on book tours. 
78, The Fixer, Joseph Finder, 9780525954613, English, 376, June 9 2015, Mystery* Thriller* Fiction* Suspense* Mystery Thriller* Crime* Audiobook, 3.72 avg rating - 7.366 ratings, 196, 2, https://www.goodreads.com/book/show/23281921-the-fixer, https://images-na.ssl-images-amazon.com/images/S/compressed.photo.goodreads.com/books/1414349079i/23281921.jpg, https://i.gr-assets.com/images/S/compressed.photo.goodreads.com/books/1414349079i/23281921._SY75_.jpg, New York Times bestselling author Joseph Finder delivers his next breakneck stand-alone thriller about the secrets families can keep* and the danger of their discovery When former investigative reporter Rick Hoffman loses his job* fiancée* and apartment* his only option is to move back into — and renovate — the home of his miserable youth* now empty and in decay since the stroke that put his father in a nursing home. As Rick starts to pull apart the old house* he makes an electrifying discovery — millions of dollars hidden in the walls. It’s enough money to completely transform Rick’s life — and everything he thought he knew about his father.   Yet the more of his father’s hidden past that Rick brings to light* the more dangerous his present becomes. Soon* he finds himself on the run from deadly enemies desperate to keep the past buried* and only solving the mystery of his father — a man who has been unable to communicate* comprehend* or care for himself for almost 20 years — will save Rick. . . if he can survive long enough to do it. , https://www.goodreads.com/author/show/63460.Joseph_Finder, https://images.gr-assets.com/authors/1539972724p5/63460.jpg, Chicago IL* The United States, http://www.josephfinder.com, Joseph Finder is the author of the forthcoming novel JUDGMENT and fourteen other novels* many of them New York Times bestsellers* published in 35 countries around the world. His book HIGH CRIMES was adapted into a movie starring Morgan Freeman and Ashley Judd- PARANOIA was made into the Harrison Ford/Gary Oldman film. He was born in Chicago* lived in the Philippines* Afghanistan* Washington State* and upstate New York. His novels have won numerous awards* including the Strand Critics award* the Barry Award* and the International Thriller Writers’ Thriller Award for best novel. His first novel* THE MOSCOW CLUB* was named by Publishers Weekly as one of the 10 best spy novels of all time. He lives with his wife in Boston and Cape Cod* where he
79, The Assassination Option (Clandestine Operations #2), W.E.B. Griffin, 9780399171246, English, 481, December 30 2014, Fiction* Historical Fiction* Thriller* Military Fiction* Espionage* War* Suspense, 4.14 avg rating - 2.198 ratings, 195, 2, https://www.goodreads.com/book/show/23013640-the-assassination-option, https://images-na.ssl-images-amazon.com/images/S/compressed.photo.goodreads.com/books/1417983003i/23013640.jpg, https://i.gr-assets.com/images/S/compressed.photo.goodreads.com/books/1417983003i/23013640._SY75_.jpg, In Top Secret* W. E. B. Griffin introduced a remarkable new cast of heroes as they found themselves on the front lines of an entirely different kind of war. Now* these men and women are going to find out what they’ve really gotten themselves into. James Cronley thought he had done well—he didn’t know he’d done this well. His first successful mission for the about-to-be-official new Central Intelligence Directorate has drawn all kinds of attention* some welcome* some not. On the plus side* he’s now a captain promoted to Chief* DCI* Europe and in charge of a top secret spy operation. On the minus side* a lot of people would like to know about that operation* including not only the Soviets* but his own Pentagon* as well as a seething J. Edgar Hoover. Cronley knows that if just one thing goes wrong* he’s likely to get thrown to the wolves. As if that weren’t enough pressure* complications are springing up on all sides. He’s discovered a surprising alliance between the former German intelligence chief and* of all things* the Mossad. A German family that Cronley never knew he had has suddenly* and suspiciously* emerged. And he’s due for a rendezvous with an undercover agent against the Soviets known only as Seven K. It’s when he meets Seven K that he gets the real surprise. , https://www.goodreads.com/author/show/1415338.W_E_B_Griffin, https://images.gr-assets.com/authors/1322727411p5/1415338.jpg, Newark* New Jersey* The United States, http://www.webgriffin.com, W.E.B. Griffin was one of several pseudonyms for William E. Butterworth III. From the Authors Website:W.E.B. Griffin was the #1 best-selling author of more than fifty epic novels in seven series* all of which have made The New York Times* The Wall Street Journal* Publishers Weekly* and other best-seller lists. More than fifty million of the books are in print in more than ten languages* including Hebrew* Chinese* Japanese* and Hungarian. Mr. Griffin grew up in the suburbs of New York City and Philadelphia. He enlisted in the United States Army in 1946. After basic training* he received counterintelligence training at Fort Holabird* Maryland. He was assigned to the Army of Occupation in Germany* and ultimately to the staff of then-Major Gene
80, The Third Target (J. B. Collins #1), Joel C. Rosenberg, 9781414336275, English, 450, January 6 2015, Fiction* Christian Fiction* Thriller* Christian* Suspense* Politics* Historical Fiction, 4.29 avg rating - 6.482 ratings, 193, 2, https://www.goodreads.com/book/show/22798864-the-third-target, https://images-na.ssl-images-amazon.com/images/S/compressed.photo.goodreads.com/books/1422215356i/22798864.jpg, https://i.gr-assets.com/images/S/compressed.photo.goodreads.com/books/1422215356i/22798864._SX50_.jpg, When New York Times foreign correspondent J. B. Collins hears rumors that an al-Qaeda splinter cell--ISIS--has captured a cache of chemical weapons inside Syria* he knows this is a story he must pursue at all costs. Does the commander of the jihadist faction really have weapons of mass destruction? If so* who is the intended target? The U. S. ? Israel? Or someone else? With tensions already high* the impending visit of the American president to the region could prove to be the spark that sets off an explosion of horrendous proportions. Knowing that terrorist forces are already trying to bring down two Arab governments in the region--Iraq and Syria--can Collins uncover the truth before it's too late? Or will the terrorists succeed in setting their sights on the third target and achieving genocide?, https://www.goodreads.com/author/show/221833.Joel_C_Rosenberg, https://images.gr-assets.com/authors/1314284800p5/221833.jpg, The United States, http://www.joelrosenberg.com, Librarian Note: There is more than one author in the Goodreads database with this name. Note: This is a different person than the fantasy author* Joel RosenbergJoel C. Rosenberg is the founder of The Joshua Fund and the New York Times best-selling author of THE LAST JIHAD (2002)* THE LAST DAYS (2003)* THE EZEKIEL OPTION (2005)* THE COPPER SCROLL (2006)* EPICENTER (2006) and DEAD HEAT (2008) with more than 1.5 million copies in print. THE EZEKIEL OPTION was named by the ECPA as the Gold Medallion winner of the "Best Novel of 2006." Joel* an evangelical Christian whose mother is Gentile and whose father is from an Orthodox Jewish background* previously worked with several U.S. and Israeli leaders* including Steve Forbes* former Israeli Deputy
81, Dead Ice (Anita Blake Vampire Hunter #24), Laurell K. Hamilton, 9780755389063, English, 566, June 9 2015, Urban Fantasy* Paranormal* Vampires* Fantasy* Romance* Paranormal Romance* Fiction, 3.94 avg rating - 14.639 ratings, 193, 2, https://www.goodreads.com/book/show/21066968-dead-ice, https://images-na.ssl-images-amazon.com/images/S/compressed.photo.goodreads.com/books/1421548154i/21066968.jpg, https://i.gr-assets.com/images/S/compressed.photo.goodreads.com/books/1421548154i/21066968._SY75_.jpg, "If you've never read this series* I highly recommend/strongly suggest having the Anita Blake experience. Vampires* zombies* and shifters* oh my! And trust me* these are not your daughter's vampires. "-LITERATI BOOK REVIEWSAnita Blake has the highest kill count of any vampire executioner in the country. She’s a U. S. Marshal who can raise zombies with the best of them. But ever since she and master vampire Jean-Claude went public with their engagement* all she is to anyone and everyone is Jean-Claude’s fiancée. It’s wreaking havoc with her reputation as a hard ass—to some extent. Luckily* in professional circles* she’s still the go-to expert for zombie issues. And right now* the FBI is having one hell of a zombie issue. Someone is producing zombie porn. Anita has seen her share of freaky undead fetishes* so this shouldn’t bother her. But the women being victimized aren’t just mindless* rotting corpses. Their souls are trapped behind their eyes* signaling voodoo of the blackest kind. It’s the sort of case that can leave a mark on a person. And Anita’s own soul may not survive unscathed . . . , https://www.goodreads.com/author/show/9550.Laurell_K_Hamilton, https://images.gr-assets.com/authors/1399387919p5/9550.jpg, Heber Springs* Arkansas* The United States, http://www.laurellkhamilton.com/, Laurell K. Hamilton is one of the leading writers of paranormal fiction. A #1 New York Times bestselling author* Hamilton writes the popular Anita Blake* Vampire Hunter novels and the Meredith Gentry series. She is also the creator of a bestselling comic book series based on her Anita Blake novels and published by Marvel Comics. Hamilton is a full-time writer and lives in the suburbs of St. Louis with her family.
