40, The Bone Clocks, David Mitchell, 9781400065677, English, 624, September 2 2014, Fiction* Fantasy* Science Fiction* Literary Fiction* Magical Realism* Contemporary* Dystopia, 3.84 avg rating - 92.795 ratings, 659, 7, https://www.goodreads.com/book/show/20819685-the-bone-clocks, https://images-na.ssl-images-amazon.com/images/S/compressed.photo.goodreads.com/books/1398205538i/20819685.jpg, https://i.gr-assets.com/images/S/compressed.photo.goodreads.com/books/1398205538i/20819685._SX50_.jpg, Following a scalding row with her mother* fifteen-year-old Holly Sykes slams the door on her old life. But Holly is no typical teenage runaway: a sensitive child once contacted by voices she knew only as “the radio people*” Holly is a lightning rod for psychic phenomena. Now* as she wanders deeper into the English countryside* visions and coincidences reorder her reality until they assume the aura of a nightmare brought to life. For Holly has caught the attention of a cabal of dangerous mystics—and their enemies. But her lost weekend is merely the prelude to a shocking disappearance that leaves her family irrevocably scarred. This unsolved mystery will echo through every decade of Holly’s life* affecting all the people Holly loves—even the ones who are not yet born. A Cambridge scholarship boy grooming himself for wealth and influence* a conflicted father who feels alive only while reporting from occupied Iraq* a middle-aged writer mourning his exile from the bestseller list—all have a part to play in this surreal* invisible war on the margins of our world. From the medieval Swiss Alps to the nineteenth-century Australian bush* from a hotel in Shanghai to a Manhattan townhouse in the near future* their stories come together in moments of everyday grace and extraordinary wonder. , https://www.goodreads.com/author/show/6538289.David_Mitchell, https://images.gr-assets.com/authors/1409248688p5/6538289.jpg, Southport* The United Kingdom, http://www.davidmitchellbooks.com/, David Mitchell was born in Southport* Merseyside* in England* raised in Malvern* Worcestershire* and educated at the University of Kent* studying for a degree in English and American Literature followed by an M.A. in Comparative Literature. He lived for a year in Sicily* then moved to Hiroshima* Japan* where he taught English to technical students for eight years* before returning to England. After another stint in Japan* he currently lives in Ireland with his wife Keiko and their two children. In an essay for Random House* Mitchell wrote: "I knew I wanted to be a writer since I was a kid* but until I came to Japan to live in 1994 I was too easily distracted to do much about it. I would probably have become a writer wherever I lived* but wo
41, Dead Heat (Alpha & Omega #4), Patricia Briggs, 9780425256756, English, 324, March 3 2015, Urban Fantasy* Fantasy* Paranormal* Romance* Werewolves* Paranormal Romance* Shapeshifters, 4.31 avg rating - 36.964 ratings, 593, 6, https://www.goodreads.com/book/show/22571699-dead-heat, https://images-na.ssl-images-amazon.com/images/S/compressed.photo.goodreads.com/books/1406232150i/22571699.jpg, https://i.gr-assets.com/images/S/compressed.photo.goodreads.com/books/1406232150i/22571699._SY75_.jpg, For once* mated werewolves Charles and Anna are not traveling because of Charles’s role as his father’s enforcer. This time* their trip to Arizona is purely personal--or at least it starts out that way. . . Charles and Anna soon discover that a dangerous Fae being is on the loose* replacing human children with simulacrums. The Fae’s cold war with humanity is about to heat up—and Charles and Anna are in the cross fire. , https://www.goodreads.com/author/show/40563.Patricia_Briggs, https://images.gr-assets.com/authors/1464488194p5/40563.jpg, Butte* Montana* The United States, https://www.patriciabriggs.com, Librarian Note: There is more than one author in the Goodreads database with this name.Patricia Briggs was born in Butte* Montana* to a children’s librarian who passed on to her kids a love of reading and books. Patricia grew up reading fairy tales and books about horses* and later developed an interest in folklore and history. When she decided to write a book of her own* a fantasy book seemed a natural choice. Patricia graduated from Montana State University with degrees in history and German and she worked for a while as a substitute teacher. Currently* she lives in Montana with her husband* children* and six horses and writes full time* much to the delight of her fans.
42, All the Single Ladies (Lowcountry Tales #10), Dorothea Benton Frank, 9780062132567, English, 357, June 2 2015, Fiction* Chick Lit* Romance* Womens Fiction* Audiobook* Southern* Adult Fiction, 3.63 avg rating - 10.480 ratings, 592, 6, https://www.goodreads.com/book/show/23215447-all-the-single-ladies, https://images-na.ssl-images-amazon.com/images/S/compressed.photo.goodreads.com/books/1432527020i/23215447.jpg, https://i.gr-assets.com/images/S/compressed.photo.goodreads.com/books/1432527020i/23215447._SY75_.jpg, The perennial New York Times bestselling author returns with an emotionally resonant novel that illuminates the power of friendship in women’s lives* and is filled with her trademark wit* poignant and timely themes* sassy* flesh-and-blood characters* and the steamy Southern atmosphere and beauty of her beloved Carolina Lowcountry. Few writers capture the complexities* pain* and joy of relationships—between friends* family members* husbands and wives* or lovers—as beloved New York Times bestselling author Dorothea Benton Frank. In this charming* evocative* soul-touching novel* she once again takes us deep into the heart of the magical Lowcountry where three amazing middle-aged women are bonded by another amazing woman’s death. Through their shared loss they forge a deep friendship* asking critical questions. Who was their friend and what did her life mean? Are they living the lives they imagined for themselves? Will they ever be able to afford to retire? How will they maximize their happiness? Security? Health? And ultimately* their own legacies?A plan is conceived and unfurls with each turn of the tide during one sweltering summer on the Isle of Palms. Without ever fully realizing how close they were to the edge* they finally triumph amid laughter and maybe even newfound love. , https://www.goodreads.com/author/show/36935.Dorothea_Benton_Frank, https://images.gr-assets.com/authors/1369417602p5/36935.jpg, Sullivan's Island* South Carolina, http://www.dotfrank.com, Dorothea Benton Frank was a New York Times best-selling American novelist of Southern fiction. She worked in the apparel industry from 1972 until 1985 and then organized fundraisers as a volunteer* before becoming a novelist.She is best known as the author of twenty novels placed in and around the Lowcountry of South Carolina. 
43, Red Queen (Red Queen #1), Victoria Aveyard, 9781409151173, English, 383, February 10 2015, Fantasy* Young Adult* Dystopia* Romance* Fiction* Young Adult Fantasy* Magic, 4.02 avg rating - 903.424 ratings, 575, 6, https://www.goodreads.com/book/show/17878931-red-queen, https://images-na.ssl-images-amazon.com/images/S/compressed.photo.goodreads.com/books/1411472322i/17878931.jpg, https://i.gr-assets.com/images/S/compressed.photo.goodreads.com/books/1411472322i/17878931._SY75_.jpg, This is a world divided by blood - red or silver. The Reds are commoners* ruled by a Silver elite in possession of god-like superpowers. And to Mare Barrow* a seventeen-year-old Red girl from the poverty-stricken Stilts* it seems like nothing will ever change. That is* until she finds herself working in the Silver Palace. Here* surrounded by the people she hates the most* Mare discovers that* despite her red blood* she possesses a deadly power of her own. One that threatens to destroy the balance of power. Fearful of Mare's potential* the Silvers hide her in plain view* declaring her a long-lost Silver princess* now engaged to a Silver prince. Despite knowing that one misstep would mean her death* Mare works silently to help the Red Guard* a militant resistance group* and bring down the Silver regime. But this is a world of betrayal and lies* and Mare has entered a dangerous dance - Reds against Silvers* prince against prince* and Mare against her own heart. . . , https://www.goodreads.com/author/show/7074943.Victoria_Aveyard, https://images.gr-assets.com/authors/1395682478p5/7074943.jpg, The United States, http://www.victoriaaveyard.com, I'm an author/screenwriter who likes books and lists. This site is the nexus of my universe.I wrote the #1 NYT bestselling series RED QUEEN and my next series* REALM BREAKER* will be out in May 2021.The genres I'm into include YA* Fantasy* Historical* Adventure* Apocalyptic - if people are dying* I'm buying.
44, Fallen (Fallen #1), Lauren Kate, 9780385738934, English, 452, December 8 2009, Young Adult* Fantasy* Romance* Paranormal* Angels* Paranormal Romance* Fiction, 3.72 avg rating - 566.035 ratings, 572, 6, https://www.goodreads.com/book/show/6487308-fallen, https://images-na.ssl-images-amazon.com/images/S/compressed.photo.goodreads.com/books/1440619649i/6487308.jpg, https://i.gr-assets.com/images/S/compressed.photo.goodreads.com/books/1440619649i/6487308._SY75_.jpg, There’s something achingly familiar about Daniel Grigori. Mysterious and aloof* he captures Luce Price’s attention from the moment she sees him on her first day at the Sword & Cross boarding school in sultry Savannah* Georgia. He’s the one bright spot in a place where cell phones are forbidden* the other students are all screw-ups* and security cameras watch every move. Even though Daniel wants nothing to do with Luce—and goes out of his way to make that very clear—she can’t let it go. Drawn to him like a moth to a flame* she has to find out what Daniel is so desperate to keep secret… even if it kills her. , https://www.goodreads.com/author/show/2905297.Lauren_Kate, https://images.gr-assets.com/authors/1641507837p5/2905297.jpg, The United States, http://laurenkatebooks.net/, Lauren Kate is the author of novels for adults* teens* and children* including the rom-com BY ANY OTHER NAME and the young adult series* FALLEN. She lives in Laurel Canyon with her family. 
45, Defending Jacob, William Landay, 9780385344227, English, 421, January 31 2012, Fiction* Mystery* Thriller* Crime* Mystery Thriller* Suspense* Audiobook, 3.99 avg rating - 289.924 ratings, 571, 6, https://www.goodreads.com/book/show/11367726-defending-jacob, https://images-na.ssl-images-amazon.com/images/S/compressed.photo.goodreads.com/books/1329612158i/11367726.jpg, https://i.gr-assets.com/images/S/compressed.photo.goodreads.com/books/1329612158i/11367726._SY75_.jpg, Award-winning author William Landay has written the consummate novel of an embattled family in crisis - a suspenseful* character-driven mystery that is also a spellbinding tale of guilt* betrayal* and the terrifying speed at which our lives can spin out of control. Andy Barber has been an assistant district attorney in his suburban Massachusetts county for more than twenty years. He is respected in his community* tenacious in the courtroom* and happy at home with his wife* Laurie* and son* Jacob. But when a shocking crime shatters their New England town* Andy is blindsided by what happens next: His fourteen-year-old son is charged with the murder of a fellow student. , https://www.goodreads.com/author/show/218843.William_Landay, https://images.gr-assets.com/authors/1263404060p5/218843.jpg, Boston* The United States, http://www.williamlanday.com, William Landay is the author of All That Is Mine I Carry With Me and three previous novels: Defending Jacob* which won the Strand Critics Award for best mystery novel- The Strangler* listed as a best crime novel of the year by the L.A. Times* Daily Telegraph and others- and Mission Flats* winner of the Dagger Award for best first crime novel. A former assistant district attorney* he lives in Boston.
46, In the Unlikely Event, Judy Blume, 9781101875049, English, 402, June 2 2015, Fiction* Historical Fiction* Audiobook* Adult Fiction* Adult* Historical* Coming Of Age, 3.55 avg rating - 65.874 ratings, 566, 6, https://www.goodreads.com/book/show/23899174-in-the-unlikely-event, https://images-na.ssl-images-amazon.com/images/S/compressed.photo.goodreads.com/books/1421711380i/23899174.jpg, https://i.gr-assets.com/images/S/compressed.photo.goodreads.com/books/1421711380i/23899174._SX50_.jpg, In her highly anticipated new novel* Judy Blume* the New York Times # 1 best-selling author of Summer Sisters and of young adult classics such as Are You There God? It’s Me* Margaret* creates a richly textured and moving story of three generations of families* friends and strangers* whose lives are profoundly changed by unexpected events. In 1987* Miri Ammerman returns to her hometown of Elizabeth* New Jersey* to attend a commemoration of the worst year of her life. Thirty-five years earlier* when Miri was fifteen* and in love for the first time* a succession of airplanes fell from the sky* leaving a community reeling. Against this backdrop of actual events that Blume experienced in the early 1950s* when airline travel was new and exciting and everyone dreamed of going somewhere* Judy Blume imagines and weaves together a haunting story of three generations of families* friends* and strangers* whose lives are profoundly changed by these disasters. She paints a vivid portrait of a particular time and place — Nat King Cole singing “Unforgettable*” Elizabeth Taylor haircuts* young (and not-so-young) love* explosive friendships* A-bomb hysteria* rumors of Communist threat. And a young journalist who makes his name reporting tragedy. Through it all* one generation reminds another that life goes on. In the Unlikely Event is a gripping novel with all the hallmarks of Judy Blume's unparalleled storytelling. , https://www.goodreads.com/author/show/12942.Judy_Blume, https://images.gr-assets.com/authors/1430843076p5/12942.jpg, Elizabeth* New Jersey* The United States, http://www.judyblume.com, Judy Blume spent her childhood in Elizabeth* New Jersey* making up stories inside her head. She has spent her adult years in many places doing the same thing* only now she writes her stories down on paper. Adults as well as children will recognize such Blume titles as: Are You There God? It's Me* Margaret- Blubber- Just as Long as We're Together- and the five book series about the irrepressible Fudge. She has also written three novels for adults* Summer Sisters- Smart Women- and Wifey* all of them New York Times bestsellers. More than 80 million copies of her books have been sold* and her work has been translated into thirty-one languages. She receives thousands of letters a year from readers of all ages who share their feelings and concern
47, Obsession in Death (In Death #40), J.D. Robb, 9780399170874, English, 404, January 12 2015, Mystery* Romance* Fiction* Crime* Romantic Suspense* Futuristic* Suspense, 4.36 avg rating - 23.150 ratings, 496, 5, https://www.goodreads.com/book/show/22571696-obsession-in-death, https://images-na.ssl-images-amazon.com/images/S/compressed.photo.goodreads.com/books/1406509523i/22571696.jpg, https://i.gr-assets.com/images/S/compressed.photo.goodreads.com/books/1406509523i/22571696._SY75_.jpg, There's a thin line between hero worship and dangerous obsession. . . the explosive new Eve Dallas and Roarke thrillerA crisp winter morning in New York. In a luxury apartment* the body of a woman lies stretched out on a huge bed. On the wall above* the killer has left a message in bold black ink: FOR LIEUTENANT EVE DALLAS* WITH GREAT ADMIRATION AND UNDERSTANDING. Eve Dallas is used to unwanted attention. Famous for her high-profile cases and her marriage to billionaire businessman Roarke* she has learned to deal with intense public scrutiny and media gossip. But now Eve has become the object of a singular and deadly obsession. She has an 'admirer'* who just can't stop thinking about her. Who is convinced they have a special bond. Who is planning to kill for her - again and again. . . With time against her* Eve is forced to play a delicate - and dangerous - psychological dance. Because the killer is desperate for something Eve can never provide - approval. And once that becomes clear* Eve knows her own life will be at risk - along with those she cares about the most. , https://www.goodreads.com/author/show/17065.J_D_Robb, https://images.gr-assets.com/authors/1481138127p5/17065.jpg, Silver Spring* Maryland* The United States, http://www.jdrobb.com/, J.D. Robb is the author of the #1 New York Times bestselling In Death series and the pseudonym for #1 New York Times bestselling author Nora Roberts. The futuristic suspense series stars Eve Dallas* a New York City police lieutenant with a dark past. Initially conceived as a trilogy* readers clamored for more of Eve and the mysterious Roarke. Forgotten in Death (St. Martin's Press* September 2021) is the 53rd entry in the series. 
48, Saint Odd (Odd Thomas #7), Dean Koontz, null, English, 352, January 1 2014, Horror* Fiction* Fantasy* Thriller* Mystery* Paranormal* Supernatural, 4.18 avg rating - 20.729 ratings, 486, 5, https://www.goodreads.com/book/show/15722284-saint-odd, https://images-na.ssl-images-amazon.com/images/S/compressed.photo.goodreads.com/books/1403303609i/15722284.jpg, https://i.gr-assets.com/images/S/compressed.photo.goodreads.com/books/1403303609i/15722284._SY75_.jpg, * Includes Dean Koontz’s short story “You Are Destined to Be Together Forever” *In a perilous journey across a landscape of beauty and terror* an unassuming but quite extraordinary young man has crossed paths with the living and the dead* the innocent and the evil. Now at last for Odd Thomas* the wandering is over. Drawn back to where it all began* to his beloved Pico Mundo* the dauntless fry cook seeks to fulfill the promise that has steered his quest since the devastating loss of his soul mate: "You are destined to be together forever. "But he hasn't come back to the small California town alone. A murderous* chaos-worshipping cult has a deadly score to settle with the unlikely hero and an apocalyptic fate to unleash upon the world. For Odd Thomas* born to serve a purpose far greater than himself* one last challenge - vast and dreadful - must be met before he can find whatever fate awaits him. , https://www.goodreads.com/author/show/9355.Dean_Koontz, https://images.gr-assets.com/authors/1581963714p5/9355.jpg, Everett* Pennsylvania* The United States, http://www.deankoontz.com, Acknowledged as "America's most popular suspense novelist" (Rolling Stone) and as one of today's most celebrated and successful writers* Dean Ray Koontz has earned the devotion of millions of readers around the world and the praise of critics everywhere for tales of character* mystery* and adventure that strike to the core of what it means to be human.Dean* the author of many #1 New York Times bestsellers* lives in Southern California with his wife* Gerda* their golden retriever* Elsa* and the enduring spirit of their goldens* Trixie and Anna. Facebook: Facebook.com/DeanKoontzOfficialTwitter: @DeanKoontzWebsite: DeanKoontz.com 
49, Torment (Fallen #2), Lauren Kate, 9780385739146, English, 452, September 28 2010, Young Adult* Fantasy* Angels* Romance* Paranormal* Paranormal Romance* Supernatural, 3.85 avg rating - 229.315 ratings, 483, 5, https://www.goodreads.com/book/show/7740152-torment, https://images-na.ssl-images-amazon.com/images/S/compressed.photo.goodreads.com/books/1362339749i/7740152.jpg, https://i.gr-assets.com/images/S/compressed.photo.goodreads.com/books/1362339749i/7740152._SY75_.jpg, Hell on earth. That’s what it’s like for Luce to be apart from her fallen angel boyfriend* Daniel. It took them an eternity to find one another* but now he has told her he must go away. Just long enough to hunt down the Outcasts—immortals who want to kill Luce. Daniel hides Luce at Shoreline* a school on the rocky California coast with unusually gifted students: Nephilim* the offspring of fallen angels and humans. At Shoreline* Luce learns what the Shadows are* and how she can use them as windows to her previous lives. Yet the more Luce learns* the more she suspects that Daniel hasn’t told her everything. He’s hiding something—something dangerous. What if Daniel’s version of the past isn’t actually true? What if Luce is really meant to be with someone else?, https://www.goodreads.com/author/show/2905297.Lauren_Kate, https://images.gr-assets.com/authors/1641507837p5/2905297.jpg, The United States, http://laurenkatebooks.net/, Lauren Kate is the author of novels for adults* teens* and children* including the rom-com BY ANY OTHER NAME and the young adult series* FALLEN. She lives in Laurel Canyon with her family. 
50, Our Souls at Night, Kent Haruf, 9781101875896, English, 179, May 26 2015, Fiction* Romance* Contemporary* Literary Fiction* Audiobook* Adult Fiction* Book Club, 3.92 avg rating - 71.669 ratings, 478, 5, https://www.goodreads.com/book/show/23602562-our-souls-at-night, https://images-na.ssl-images-amazon.com/images/S/compressed.photo.goodreads.com/books/1418766517i/23602562.jpg, https://i.gr-assets.com/images/S/compressed.photo.goodreads.com/books/1418766517i/23602562._SX50_.jpg, A spare yet eloquent* bittersweet yet inspiring story of a man and a woman who* in advanced age* come together to wrestle with the events of their lives and their hopes for the imminent future. In the familiar setting of Holt* Colorado* home to all of Kent Haruf's inimitable fiction* Addie Moore pays an unexpected visit to a neighbor* Louis Waters. Her husband died years ago* as did his wife* and in such a small town they naturally have known of each other for decades in fact* Addie was quite fond of Louis's wife. His daughter lives hours away in Colorado Springs* her son even farther away in Grand Junction* and Addie and Louis have long been living alone in houses now empty of family* the nights so terribly lonely* especially with no one to talk with. Their brave adventures - their pleasures and their difficulties - are hugely involving and truly resonant* making Our Souls at Night the perfect final installment to this beloved writer's enduring contribution to American literature. , https://www.goodreads.com/author/show/16266.Kent_Haruf, https://images.gr-assets.com/authors/1594045311p5/16266.jpg, Pueblo* Colorado* The United States, Kent Haruf’s books, Kent Haruf was born in eastern Colorado. He received his Bachelors of Arts in literature from Nebraska Wesleyan University in 1965 and his Masters of Fine Arts from the Iowa Writers' Workshop at the University of Iowa in 1973. For two years* he taught English in Turkey with the Peace Corps and his other jobs have included a chicken farm in Colorado* a construction site in Wyoming* a rehabilitation hospital in Colorado* a hospital in Arizona* a library in Iowa* an alternative high school in Wisconsin* and universities in Nebraska and Illinois.Haruf is the author of Plainsong* which received the Mountains and Plains Booksellers Award* the Los Angeles Times Book Prize* the Maria Thomas Award in Fiction* and The New Yorker Book Award. Plainsong
51, Rain on the Dead (Sean Dillon #21), Jack Higgins, 9780399171949, English, 310, December 30 2014, Fiction* Thriller* Mystery* Espionage* Mystery Thriller* Action* Spy Thriller, 3.78 avg rating - 2.532 ratings, 396, 4, https://www.goodreads.com/book/show/20821202-rain-on-the-dead, https://images-na.ssl-images-amazon.com/images/S/compressed.photo.goodreads.com/books/1396830412i/20821202.jpg, https://i.gr-assets.com/images/S/compressed.photo.goodreads.com/books/1396830412i/20821202._SY75_.jpg, The past comes back to haunt Sean Dillon and his colleagues* as the New York Times–bestselling master of suspense returns with a knife-edge story of terrorism* revenge* and a very old nemesis. In the past few years* the killing and capture of many Al-Qaeda leaders has left the terrorist organization wounded—but by no means dead. And they intend to prove it. On a dark summer night* two Chechen mercenaries emerge from the waters off Nantucket to kill a high-value target* the former president of the United States* Jake Cazalet. Unfortunately for them* Cazalet has guests with him* including black ops specialist Sean Dillon and his colleague* Afghan war hero Captain Sara Gideon. The Chechens do not survive the night* but Dillon is curious as to how they even got on the island. What he discovers sends a chill through his bones—a name from very far back in Dillon’s past. If this man is working with the terrorists now* the assassination attempt is only the beginning—and the next time* the results might be much* much different. , https://www.goodreads.com/author/show/19706.Jack_Higgins, https://images.gr-assets.com/authors/1337532450p5/19706.jpg, Newcastle upon Tyne* England* The United Kingdom, http://jackhiggins.co.za/, There is more than one author in the Goodreads database with this name.Jack Higgins is the best known of the many pseudonyms of Henry Patterson. (See also Martin Fallon* Harry Patterson* Hugh Marlowe and James Graham.)He is the New York Times bestselling author of more than seventy thrillers* including The Eagle Has Landed and The Wolf at the Door. His books have sold more than 250 million copies worldwide.Born in Newcastle upon Tyne* England* Patterson grew up in Belfast* Northern Ireland. As a child* Patterson was a voracious reader and later credited his passion for reading with fueling his creative drive to be an author. His upbringing in Belfast also exposed him to the political and religious violence that characterized the city at the
